{"arms":[{"holders":[1,2,3],"profile_id":"LOCUS-paired-suite-deployment-2of3-v1","suite_id":"LOCUS-APPSS-2HASHDH-RISTRETTO255-SHA512-GF128-v1"},{"holders":[1,2,3],"profile_id":"LOCUS-paired-suite-deployment-2of3-v1","suite_id":"LOCUS-TPASS-YI-ZK-RISTRETTO255-v1"},{"holders":[1,2,3,4,5],"profile_id":"LOCUS-paired-suite-deployment-3of5-v1","suite_id":"LOCUS-APPSS-2HASHDH-RISTRETTO255-SHA512-GF128-v1"},{"holders":[1,2,3,4,5],"profile_id":"LOCUS-paired-suite-deployment-3of5-v1","suite_id":"LOCUS-TPASS-YI-ZK-RISTRETTO255-v1"}],"authorization":{"authorizers":[1,2,3,4,5],"quorum":4},"client_template":{"api_version":"LOCUS-client-api-v2","clean_client_profile":"LOCUS-clean-client-isolation-v2","identity":"spiffe://locus.invalid/integrated/managed-client","instance_profile":"LOCUS-managed-client-instance-v1","networks":["admission","browser-edge","client-lifecycle","control","recovery","resolver","storage"],"package_format":"LOCUS-client-recovery-package-v1","ui_profile":"LOCUS-managed-client-ui-v1"},"control_plane":{"controller_api":"LOCUS-container-controller-api-v1","controller_profile":"LOCUS-local-container-controller-v1","manager_api":"LOCUS-manager-api-v1","manager_ui_profile":"LOCUS-local-manager-ui-v1"},"deployment_id":"LOCUS-integrated-manager-deployment-v1","networks":["admission","browser-edge","client-lifecycle","cloud","control","management","manager-edge","recovery","resolver","storage"],"policies":["LOCUS-canonical-email-set-v1","LOCUS-canonical-phone-set-v1","LOCUS-location-person-set-v1","LOCUS-quantized-coordinate-set-v1"],"provider":{"adapter":"s3-compatible-local","backup_object_format":"LOCUS-cloud-backup-object-v2","endpoint":"http://s3:8333","gateway_profile":"LOCUS-application-storage-gateway-v2","list_allowed":false,"tls_mode":"internal-emulation-only"},"security_matrix":"LOCUS-security-matrix-v2","services":[{"endpoint":"https://admission:8443","identity":"spiffe://locus.invalid/integrated/admission","name":"admission","networks":["admission"],"persistent_role":true},{"endpoint":null,"identity":"spiffe://locus.invalid/integrated/bootstrap","name":"bootstrap","networks":[],"persistent_role":false},{"endpoint":"https://manager-controller:8443","identity":"spiffe://locus.invalid/integrated/manager-controller","name":"manager-controller","networks":["client-lifecycle","management"],"persistent_role":false},{"endpoint":"http://127.0.0.1:8765","identity":"spiffe://locus.invalid/integrated/manager-ui","name":"manager-ui","networks":["management","manager-edge"],"persistent_role":false},{"endpoint":"https://operator:8443","identity":"spiffe://locus.invalid/integrated/operator","name":"operator","networks":["control"],"persistent_role":true},{"endpoint":"https://party1:8443","identity":"spiffe://locus.invalid/integrated/party1","name":"party1","networks":["recovery"],"persistent_role":true},{"endpoint":"https://party2:8443","identity":"spiffe://locus.invalid/integrated/party2","name":"party2","networks":["recovery"],"persistent_role":true},{"endpoint":"https://party3:8443","identity":"spiffe://locus.invalid/integrated/party3","name":"party3","networks":["recovery"],"persistent_role":true},{"endpoint":"https://party4:8443","identity":"spiffe://locus.invalid/integrated/party4","name":"party4","networks":["recovery"],"persistent_role":true},{"endpoint":"https://party5:8443","identity":"spiffe://locus.invalid/integrated/party5","name":"party5","networks":["recovery"],"persistent_role":true},{"endpoint":"https://resolver:8443","identity":"spiffe://locus.invalid/integrated/resolver","name":"resolver","networks":["resolver"],"persistent_role":false},{"endpoint":"http://s3:8333","identity":"spiffe://locus.invalid/integrated/s3","name":"s3","networks":["cloud"],"persistent_role":true},{"endpoint":"https://storage-gateway:8443","identity":"spiffe://locus.invalid/integrated/storage-gateway","name":"storage-gateway","networks":["cloud","storage"],"persistent_role":true}],"version":"LOCUS-integrated-manager-config-v1"}
